{
  "officer_id": "passport",
  "dept_id": "D-CIVIL",
  "team": "여권팀",
  "name": "여권 AI 주무관",
  "title": "민원여권과 여권팀 AI 주무관",
  "room_id": "minwon",
  "intro": "여권 접수·재발급·분실신고·기재사항 변경을 맡은 AI 주무관입니다. 여권법령과 외교부 여권안내, 여권팀 업무분장에서 근거를 찾아 답하고, 근거 쪽을 함께 보여 드립니다. 모든 답은 초안이며 최종 판단은 담당자가 합니다.",
  "seat_ids": ["S-CIVIL-15", "S-CIVIL-16", "S-CIVIL-17", "S-CIVIL-18", "S-CIVIL-19", "S-CIVIL-20"],
  "doc_ids": [
    "passport-act",
    "passport-act-decree",
    "passport-act-rule",
    "passport-guide-issue",
    "passport-guide-reissue",
    "passport-guide-basics",
    "passport-use-restriction-notice",
    "passport-romanization-notice"
  ],
  "modes": {
    "ask": {
      "label": "업무 묻기",
      "hint": "신규 발령자·동료가 여권 업무를 묻습니다.",
      "samples": [
        "유효기간이 남은 여권을 재발급하면 기존 여권은 어떻게 되나요?",
        "18세 미만 재발급 신청 때 법정대리인 동의는 어떻게 받나요?",
        "로마자 성명 변경은 어떤 경우에 가능한가요?",
        "여권 분실신고 후 다시 찾으면 그 여권을 쓸 수 있나요?"
      ]
    },
    "notice": {
      "label": "안내문 만들기",
      "hint": "민원 상황을 적으면 민원인에게 드릴 구비서류·수수료 안내문 초안을 만듭니다.",
      "samples": [
        "만 15세 자녀 여권 유효기간 만료로 부모가 대리 신청하려고 함",
        "해외여행 앞두고 여권을 잃어버려 재발급받으려는 성인",
        "개명 후 여권의 한글 성명을 바꾸려는 민원인"
      ]
    },
    "roleplay": {
      "label": "응대 연습",
      "hint": "AI가 가상 민원인을 맡고, 내가 창구 담당자로 응대합니다. 한 번 답할 때마다 근거와 함께 코칭을 받습니다.",
      "samples": []
    }
  },
  "scenarios": [
    {
      "scenario_id": "lost-before-trip",
      "title": "출국 사흘 전 여권 분실",
      "persona": "가상민원인A, 40대 직장인. 사흘 뒤 출장 출국인데 여권을 잃어버려 급하다.",
      "opening": "저기요, 제가 사흘 뒤에 출장을 가야 하는데 여권을 잃어버렸어요. 오늘 바로 새로 만들 수 있나요?",
      "facts": "신분증은 가지고 있음. 여권 사진은 없음. 분실 장소는 모름. 긴급여권이 가능한지 궁금해함."
    },
    {
      "scenario_id": "minor-reissue",
      "title": "중학생 자녀 여권 대리 신청",
      "persona": "가상민원인B, 중학생 자녀를 둔 부모. 자녀는 학교에 있어 같이 오지 못했다.",
      "opening": "아이 여권이 만료돼서 왔는데요, 아이는 학교에 있어서 저 혼자 왔어요. 제가 대신 신청해도 되죠?",
      "facts": "자녀는 만 14세. 부모 신분증 지참. 자녀 사진은 가져옴. 가족관계 증명서는 안 가져옴."
    },
    {
      "scenario_id": "english-name",
      "title": "로마자 성명 철자 변경 요구",
      "persona": "가상민원인C, 30대. 여권 영문 이름 철자가 마음에 들지 않아 바꾸고 싶어 한다.",
      "opening": "여권 영문 이름 철자를 바꾸고 싶은데요. 그냥 신청서에 새로 쓰면 되는 거 아니에요?",
      "facts": "해외 체류·학위 등 증빙 없음. 단순 선호로 변경을 원함."
    }
  ]
}
